<?xml version="1.0" encoding="UTF-8" ?>
<Persons xmlns="http://vashukevich.it-academy.by/xml/Persons"
         xmlns:xsi="http://www.w3.org/2001/XMLSchema-instance"
         xsi:schemaLocation="http://vashukevich.it-academy.by/xml/Persons ad.xsd">
    <Person>
        <Email>
            vashukevich@mail.ru
        </Email>
        <Nickname>
            vashuk84
        </Nickname>
        <Password>
            01011984
        </Password>
        <Ads>
            <Ad>
                <Description>
                    Хорошая квартира
                </Description>
                <Address>
                    Хоружей 13-12
                </Address>
                <Floor>
                    3
                </Floor>
                <Floors>
                    5
                </Floors>
                <Area>
                    49.0
                </Area>
            </Ad>

            <Ad>
                <Description>
                    Очень хорошая квартира
                </Description>
                <Address>
                    Хоружей 13-12
                </Address>
                <Floor>
                    23
                </Floor>
                <Floors>
                    25
                </Floors>
                <Area>
                    79.0
                </Area>
            </Ad>

        </Ads>
    </Person>
</Persons>